{
  "$schema": "../../../map/map.schema.json",
  "title": "Change a clinic",
  "summary": "Edit a single clinic or a whole clinic series (the date is editable).",
  "section": "Manage clinics",
  "status": "ready for dev",
  "steps": [
    {
      "id": "summary",
      "title": "Clinic summary",
      "summary": "Review the clinic and choose what to change.",
      "defaultVariant": "default",
      "variants": [
        { "id": "default", "label": "Series", "screenshots": [{ "label": "Summary", "path": "/v1/site/1/clinics/edit/82ac86fd34f9a597", "data": {} }] }
      ]
    },
    {
      "id": "clinic-times",
      "title": "Change times and capacity",
      "summary": "Edit the hours, appointment length and capacity.",
      "defaultVariant": "default",
      "variants": [
        { "id": "default", "label": "Default", "screenshots": [{ "label": "Times", "path": "/v1/site/1/clinics/edit/82ac86fd34f9a597/clinic-times", "data": {} }] }
      ]
    },
    {
      "id": "services",
      "title": "Change services",
      "summary": "Edit which vaccinations are offered.",
      "defaultVariant": "default",
      "variants": [
        { "id": "default", "label": "Default", "screenshots": [{ "label": "Services", "path": "/v1/site/1/clinics/edit/82ac86fd34f9a597/services", "data": {} }] }
      ]
    },
    {
      "id": "clinic-closures",
      "title": "Change closures",
      "summary": "Add or remove dates the series skips.",
      "defaultVariant": "default",
      "variants": [
        { "id": "default", "label": "Default", "screenshots": [{ "label": "Closures", "path": "/v1/site/1/clinics/edit/82ac86fd34f9a597/clinic-closures", "data": {} }] }
      ]
    },
    {
      "id": "check-answers",
      "title": "Check answers",
      "summary": "Review the changes before saving.",
      "defaultVariant": "default",
      "variants": [
        { "id": "default", "label": "Default", "screenshots": [{ "label": "Review", "path": "/v1/site/1/clinics/edit/82ac86fd34f9a597/check-answers", "data": {} }] }
      ]
    }
  ]
}
