{
  "$schema": "../../../map/map.schema.json",
  "title": "Clinics list",
  "summary": "See all clinics for a site, with pagination.",
  "section": "Getting around",
  "status": "ready for dev",
  "steps": [
    {
      "id": "clinics-list",
      "title": "Clinics list",
      "summary": "Every clinic series and single clinic for the site.",
      "defaultVariant": "default",
      "variants": [
        { "id": "default", "label": "First page", "screenshots": [{ "label": "Page 1", "path": "/v1/site/1/clinics", "data": {} }] },
        { "id": "page-two", "label": "Second page", "screenshots": [{ "label": "Page 2", "path": "/v1/site/1/clinics?page=2", "data": {} }] }
      ]
    }
  ]
}
