{
  "$schema": "../../../map/map.schema.json",
  "title": "Cancel a clinic",
  "summary": "Cancel a whole clinic and decide what happens to its bookings.",
  "section": "Manage clinics",
  "status": "ready for dev",
  "steps": [
    {
      "id": "check-answers",
      "title": "Check answers",
      "summary": "Confirm the clinic to cancel and whether to keep or cancel its bookings.",
      "defaultVariant": "default",
      "variants": [
        { "id": "default", "label": "Default", "screenshots": [{ "label": "Review", "path": "/v1/site/1/clinics/cancel/82ac86fd34f9a597/check-answers", "data": {} }] }
      ]
    }
  ]
}
