{
  "$schema": "../../../map/map.schema.json",
  "title": "Sites and dashboard",
  "summary": "Choose a site and see its dashboard.",
  "section": "Getting around",
  "status": "ready for dev",
  "steps": [
    {
      "id": "all-sites",
      "title": "All sites",
      "summary": "Pick the site to manage.",
      "defaultVariant": "default",
      "variants": [
        { "id": "default", "label": "Default", "screenshots": [{ "label": "Default", "path": "/v1/sites", "data": {} }] }
      ]
    },
    {
      "id": "dashboard",
      "title": "Site dashboard",
      "summary": "Overview and entry points for a single site.",
      "defaultVariant": "default",
      "variants": [
        { "id": "default", "label": "Default", "screenshots": [{ "label": "Default", "path": "/v1/site/1", "data": {} }] }
      ]
    }
  ]
}
