{
  "$schema": "../../../map/map.schema.json",
  "title": "View availability",
  "summary": "See clinics and capacity by day, week or month.",
  "section": "Getting around",
  "status": "ready for dev",
  "steps": [
    {
      "id": "day",
      "title": "Day view",
      "summary": "A single day's clinics and slots.",
      "defaultVariant": "default",
      "variants": [
        { "id": "default", "label": "Default", "screenshots": [{ "label": "Today", "path": "/v1/site/1/availability/day", "data": {} }] }
      ]
    },
    {
      "id": "week",
      "title": "Week view",
      "summary": "A week of clinics with daily totals.",
      "defaultVariant": "default",
      "variants": [
        { "id": "default", "label": "Default", "screenshots": [{ "label": "This week", "path": "/v1/site/1/availability/week", "data": {} }] }
      ]
    },
    {
      "id": "month",
      "title": "Month view",
      "summary": "A month calendar of availability.",
      "defaultVariant": "default",
      "variants": [
        { "id": "default", "label": "Default", "screenshots": [{ "label": "This month", "path": "/v1/site/1/availability/month", "data": {} }] }
      ]
    }
  ]
}
